<?xml version="1.0" encoding="UTF-8"?>

<!DOCTYPE venus PUBLIC "-//ninecube//venus1.0//EN" "http://www.ninecube.net/venus/venus.dtd">

<venus>

	<package name="customergroup" cname="客户群管理" >
		<model entity="customergroup" class="net.ninecube.venus.domain.CustomerGroup">
			<field name="idno" cname="ID" type="integer" key="true" />
			<field name="name" cname="名称" maxlen="20" req="true" />
			<modelfields name="parent" cname="上级客户群" model="customergroup" >name</modelfields>
			<field name="rule" cname="划分规则" maxlen="255" req="true" />
			<field name="description" cname="描述" maxlen="255" />
			<modelfields name="evaluation" cname="评价体系" model="evaluation" req="true">name</modelfields>
			<field name="creationDate" cname="创建日期" type="date" >${today}</field>
			<field name="creator" cname="创建人" >${user.name}</field>
		</model>

		<transaction name="query" cname="查询" >
			<input>
				<queryfield name="name" op="like" />
				<queryfield name="creationDate" op="between" />
				<queryfield name="creator" op="eq" />
			</input>
			<output>
				<includefields tagtype="text">*</includefields>
				<mergefield name="idno" tagtype="radio" />
			</output>
		</transaction>
		
		<transaction name="read" cname="查看" />
		<transaction name="create" cname="新建" />
		<transaction name="update" cname="修改" />
		<transaction name="delete" cname="删除" />
		
		<transaction name="eval" cname="评价" >
			<input>
				<modelfields name="customerGroup" cname="客户群" model="customergroup">name</modelfields>
				<modelfields name="evaluation" cname="评价体系" model="evaluation">name</modelfields>
				<modelfields name="referGroup" cname="参照客户群" model="customergroup">name</modelfields>
				<field name="referDate" cname="基期" type="date" ></field>
			</input>
		</transaction>
		
	</package>
		
</venus>



